{
  "$schema": "../../schema/fragment.schema.json",
  "documentKind": "capability-graph-mapping-fragment",
  "schemaVersion": "1.3.0",
  "fragmentId": "fragment.10b-literature-decision.v1",
  "title": "Literature-derived comparison, decision, certification, and saliency mechanisms",
  "description": "Complete typings for the remaining twelve Section 10 literature-derived mechanisms. The records expose policy, calibration, model, and runtime conditions without selecting bindings, a pipeline, or an architecture.",
  "sourceSnapshot": {
    "path": "research/v4/MECHANISMS.md",
    "gitCommit": "f348d363278e0881fe50e446644a97f220eb9153",
    "gitBlob": "87cd4eee2e01b3c46fffe91d64b330c192909d47",
    "gitTree": "c9db4da6ee7f6acef729af2cb4ffc1d325e2b191",
    "gitCommitTimestamp": "2026-08-30T22:40:39+02:00",
    "sha256": "3b60e57482786a977e3526989a21abefb85d1f9cd417762ca65e3d89ec2824c5",
    "byteLength": 196653,
    "lineCount": 2625,
    "mechanismCount": 149
  },
  "artifactTypes": [
    {
      "id": "artifact.raster.native-srgb8-opaque.v1",
      "productFocus": "product-flow",
      "label": "Native opaque sRGB8 raster",
      "description": "The once-decoded, native-dimension, three-channel opaque 8-bit sRGB raster with no resampling.",
      "category": "raster",
      "plane": "runtime",
      "axisPositionId": "commitment.native-source",
      "laneId": "lane.image-and-color",
      "contractMaturity": "frozen",
      "boundaryClassification": "internal",
      "sourceNotes": [
        "This is the fixed left product anchor and the NativeRaster output in research/v4/MECHANISMS.md:82-96."
      ],
      "provenanceNotes": [
        "Native dimensions, pixel order, source hash, and decode identity remain available through paired custody metadata."
      ]
    },
    {
      "id": "artifact.statistic.weighted-color-spatial-distribution.v1",
      "productFocus": "full-analysis-only",
      "label": "Weighted color/spatial distribution",
      "description": "A finite normalized or unnormalized measure over declared color and optional spatial coordinates, with stable support IDs and nonnegative masses.",
      "category": "statistic",
      "plane": "runtime",
      "axisPositionId": "commitment.derived-measurement",
      "laneId": "lane.image-and-color",
      "contractMaturity": "draft",
      "boundaryClassification": "internal",
      "sourceNotes": [
        "Two such distributions are the natural inputs named at MECHANISMS.md:2202-2205."
      ],
      "provenanceNotes": [
        "Records support construction, coordinate units, color space, mass normalization, and whether the measure describes artwork, a field hypothesis, or a candidate palette.",
        "A palette distribution is not an exact UI treatment and carries no role or publication authority."
      ]
    },
    {
      "id": "artifact.configuration.unbalanced-optimal-transport.v1",
      "productFocus": "inspector-metadata",
      "label": "Unbalanced optimal-transport configuration",
      "description": "Pinned ground-cost definition, mass creation/destruction divergence and penalties, regularization, solver, stopping, numeric precision, and deterministic tie policy.",
      "category": "configuration",
      "plane": "governance",
      "axisPositionId": "commitment.native-source",
      "laneId": "lane.configuration-and-governance",
      "contractMaturity": "draft",
      "boundaryClassification": "expected-external",
      "sourceNotes": [
        "Makes the ground cost and mass-relaxation parameters at MECHANISMS.md:2204-2207 explicit."
      ],
      "provenanceNotes": [
        "Ground cost and mass penalty are exchange rates and require independent revision identity and sensitivity analysis."
      ]
    },
    {
      "id": "artifact.measurement.unbalanced-transport-plan.v1",
      "productFocus": "secondary-overlay",
      "label": "Unbalanced transport plan",
      "description": "A sparse or dense coupling between stable support IDs, including transported mass and solver status under one pinned unbalanced-transport configuration.",
      "category": "measurement",
      "plane": "development",
      "axisPositionId": "commitment.derived-measurement",
      "laneId": "lane.development-diagnostics",
      "contractMaturity": "draft",
      "boundaryClassification": "internal",
      "sourceNotes": [
        "Transport-plan output at MECHANISMS.md:2204-2205."
      ],
      "provenanceNotes": [
        "Support IDs bind plan entries to both input distributions; nonconvergence is not represented as a valid plan."
      ]
    },
    {
      "id": "artifact.statistic.unbalanced-unmatched-mass.v1",
      "productFocus": "secondary-overlay",
      "label": "Unbalanced unmatched-mass account",
      "description": "Per-support and aggregate mass creation, destruction, and unmatched-mass quantities for both sides of an unbalanced transport comparison.",
      "category": "statistic",
      "plane": "development",
      "axisPositionId": "commitment.derived-measurement",
      "laneId": "lane.development-diagnostics",
      "contractMaturity": "draft",
      "boundaryClassification": "internal",
      "sourceNotes": [
        "Unmatched-mass output at MECHANISMS.md:2204-2205."
      ],
      "provenanceNotes": [
        "Retains side, support ID, mass units, and mass-relaxation configuration identity."
      ]
    },
    {
      "id": "artifact.diagnostic.unbalanced-transport-cost-decomposition.v1",
      "productFocus": "secondary-overlay",
      "label": "Unbalanced transport cost decomposition",
      "description": "A diagnostic decomposition of movement, mass-relaxation, and regularization contributions, with objective and convergence values.",
      "category": "diagnostic",
      "plane": "development",
      "axisPositionId": "commitment.derived-measurement",
      "laneId": "lane.development-diagnostics",
      "contractMaturity": "draft",
      "boundaryClassification": "internal",
      "sourceNotes": [
        "Cost-decomposition output and scalar-judge warning at MECHANISMS.md:2205-2207."
      ],
      "provenanceNotes": [
        "This is an evaluation artifact, not a treatment score, selector, or product decision."
      ]
    },
    {
      "id": "artifact.provenance.transport-correspondence.v1",
      "productFocus": "secondary-overlay",
      "label": "Transport correspondence provenance",
      "description": "Identity and derivation record for both distributions, their support ordering, ground cost, relaxation settings, solver revision, and execution status.",
      "category": "provenance",
      "plane": "development",
      "axisPositionId": "commitment.derived-measurement",
      "laneId": "lane.development-diagnostics",
      "contractMaturity": "draft",
      "boundaryClassification": "internal",
      "sourceNotes": [
        "Correspondence-provenance output at MECHANISMS.md:2204-2205."
      ],
      "provenanceNotes": [
        "Preserves failed and converged executions without turning either into role evidence."
      ]
    },
    {
      "id": "artifact.graph.weighted-attributed-metric-space.v1",
      "productFocus": "full-analysis-only",
      "label": "Weighted attributed metric space",
      "description": "A finite support with stable IDs, nonnegative masses, feature vectors and feature metric, plus a declared pairwise structural-distance matrix.",
      "category": "graph",
      "plane": "runtime",
      "axisPositionId": "commitment.structured-evidence",
      "laneId": "lane.structure-and-field",
      "contractMaturity": "draft",
      "boundaryClassification": "internal",
      "sourceNotes": [
        "The two weighted attributed metric spaces named at MECHANISMS.md:2215-2218."
      ],
      "provenanceNotes": [
        "Records support construction, feature units, pairwise-relation units, mass normalization, and stable ordering.",
        "The contract is structural evidence, not a role assignment or complete treatment."
      ]
    },
    {
      "id": "artifact.configuration.fused-gromov-wasserstein.v1",
      "productFocus": "inspector-metadata",
      "label": "Fused Gromov-Wasserstein configuration",
      "description": "Pinned feature cost, structural loss, feature/structure tradeoff, regularization, initialization, solver, restart, stopping, precision, and deterministic selection policy.",
      "category": "configuration",
      "plane": "governance",
      "axisPositionId": "commitment.native-source",
      "laneId": "lane.configuration-and-governance",
      "contractMaturity": "draft",
      "boundaryClassification": "expected-external",
      "sourceNotes": [
        "Makes the feature/structure tradeoff at MECHANISMS.md:2217-2220 explicit."
      ],
      "provenanceNotes": [
        "Initialization and restart policy are load-bearing because the optimization is nonconvex."
      ]
    },
    {
      "id": "artifact.measurement.fused-gromov-wasserstein-coupling.v1",
      "productFocus": "secondary-overlay",
      "label": "Fused Gromov-Wasserstein coupling",
      "description": "A coupling over stable support IDs from two weighted attributed metric spaces under one pinned fused objective and solver execution.",
      "category": "measurement",
      "plane": "development",
      "axisPositionId": "commitment.derived-measurement",
      "laneId": "lane.development-diagnostics",
      "contractMaturity": "draft",
      "boundaryClassification": "internal",
      "sourceNotes": [
        "Coupling output at MECHANISMS.md:2217-2218."
      ],
      "provenanceNotes": [
        "Includes initialization, restart, convergence, objective, and support-order identity; a nonconverged run has no valid coupling."
      ]
    },
    {
      "id": "artifact.diagnostic.fused-gromov-wasserstein-evaluation.v1",
      "productFocus": "secondary-overlay",
      "label": "Fused Gromov-Wasserstein diagnostic evaluation",